Rondleidingen in Hotel d'Hane Steenhuyse,Uitzonderlijk kan het Hotel d'Hane Steenhuyse - een 18de-eeuws stadspaleis - onder begeleiding van een gids worden bezocht.,18/07/2011,15:30,16:30,"Hotel d'Hane Steenhuyse, Veldstraat 55, Gent",1,100,51.0515844,3.7214225
Chansons à la carte met Guido Belcanto en Derek,"Van Derek weten we al langer dat hij graag in het Frans zingt, maar dat ook Guido Belcanto een zwak heeft voor het Franse lied is een groter geheim! Samen met muzikanten Yves Meersschaert en Mario Vermandel brengen ze hun favoriete Franstalige chansons.",18/07/2011,17:30,19:00,"Het Huis van Alijn, Kraanlei 65, Gent",0,1000,51.0574921,3.7234722
Boottocht met Hanneke Tanneke Toverheks + gratis ijsje. Duur 40 min.,"Vaar mee met Hanneke Tanneke: een lelijke, vrolijke, superslordige heks die de Gentse wateren tijdens de Feesten onveilig maakt. Kleuters en kinderen tot 8 jaar helpen Hanneke om een heel speciale toverdrank te brouwen.",18/07/2011,16:00,16:40,"Aanlegsteiger Boat in Gent, bij Gravensteen (50m), Kraanlei , Gent",0,1000,51.0569531,3.7226146
Romantic Paddling,"Romantische rondvaart in de oude Gentse binnenstad met een Canadese kano, al dan niet voorzien van een bubbeltje.  Voor mensen met een sportieve ingesteldheid en zin voor avontuur en cultuur.",18/07/2011,10:00,19:00,"Sint Michielsbrug, Predikherenlei 2, Gent",0,50,51.0534952,3.7209076
Expo  Mbongeni BUTHELEZI  (Zuid-Afrika),"Mbongeni BUTHELEZI is opgegroeid in Soweto, Johannesburg. Zijn schilderijen zijn een optimistische weergave van het leven in een township. Hij heeft een techniek ontwikkeld waarbij hij gerecycleerde plastic verpakkingen smelt met een hete lucht blazer.",18/07/2011,16:00,21:00,"tse-tse-art gallery hedendaagse afrikaanse kunst, Sint-Joriskaai 18, Gent",1,50,51.0564168,3.7328153
Willem de Zwijger en zijn band met Gent. ,Gastheer : Prof. Matthias Storme. We ontdekken de politiek van Willem van Oranje en de historische plaatsen in Gent die daar betrekking op hebben. Uiteraard vergeten we de Pacificatie van Gent niet!,18/07/2011,10:30,12:30,"Pacificatiehuis, Burgstraat 55, Gent",0,50,51.0563648,3.7171713
"Robert Schumann: Papillons Op. 2, Pianokwintet Op. 44","met Prof. Lilia Umnova, Ljudmila Garbuza, Alexander Pavtchinskij, Bart Verhaeghe",18/07/2011,20:00,21:00,"KANTL, Koningstraat 18, Gent",0,50,51.0554501,3.7278414
Speciale rondleiding ‘Achter de schermen’ in de Etnografische Verzamelingen.,Hoe wordt een voorwerp een museumstuk? Komt elke gift in een vitrine? Werp eens een blik in de reserves. Pas zelf een paar witte handschoenen en betast eens een voorwerp en kom meer te weten over conservatie.   Plaatsen beperkt; reserveren verplicht!,18/07/2011,14:00,15:30,"Het Pand, Onderbergen 1, Gent",0,50,51.052799,3.7198035
Vitalski - De Gelaarsde Kat,"Een hilarische vertelling zoals alleen Vitalski dit kan; een roetsjbaan van krankzinnige vondsten, erotische bespiegelingen en indringende filosofieën. 70 minuten doorlachen, ook voor mensen die toevallig met een depressie de zaal binnen komen...",18/07/2011,22:30,00:00,"Domzaal - Kunstencentrum Vooruit, Sint-Pietersnieuwstraat 23, Gent",1,1000,51.05665,3.72
"Verliefd op Gent, of op het punt het te worden?",Luchtige initiatie-rite tot het statuut van Gentenaar. Sterk aanbevolen voor al wie graag in Gent blijft plakken en zich een muileke Gents wil eigen maken,18/07/2011,19:00,20:00,"Aanlegsteiger De Bootjes Van Gent - Rederij Dewaele, Korenlei , Gent",0,1000,51.054856,3.7201238
"ALLADIN en de WONDERLAMP, poppentheater met Pierke van Gent","Poppentheater voor families met kinderen. Dit jaar wordt het Oosterse Sprookje 'Alladin en de Wonderlamp' opgevoerd, waar ook Pierke een belangrijke rol in speelt.  Het verhaal is gekend: Alladin een arme jongen wordt een Prins uit 1001 nachten.",18/07/2011,14:30,16:15,"François Laurent Instituut, Onderstraat 10, Gent",1,1000,51.055996,3.724532
Kuitbeen (workshop) - WiSPER (BE) - betalend,Een workshop van Isabelle Handschoenserker waarbij de deelnemers op zoek gaan naar beelden en theatrale vormen. Voor wie houdt van beweging en het absurde.,18/07/2011,14:00,18:00,"Astridpark, Ferdinand Lousbergskaai , Gent",0,50,51.0485796,3.7389401
De Mannen,Het sluitstuk van de trilogie ‘de Soprano’s van Ledeberg',18/07/2011,20:00,21:30,"Minardschouwburg, Walpoortstraat 15, Gent",0,50,51.048845,3.7270658
"Filmvoorstelling  ""Plastic Planet""",We zijn allemaal verslaafd aan plastic. De mensheid vergiftigt zichzelf langzaam maar zeker...  een onthutsende documentaire...,18/07/2011,14:00,15:40,"Augustijnenklooster Sint-Stefanus, Academiestraat 1, Gent",1,50,51.0593912,3.7198089
CLUB FM 104.5fm & FAMILYRADIO 105.7fm,"10 dagen ""Live"" radio vanop de Gentse Feesten, dagelijks van 15u - 22u.",18/07/2011,14:00,22:00,"Oude Vismijn, Sint-Veerleplein 5, Gent",0,100,51.0567346,3.7213135
"Gent, bakermat van het socialisme",Gent was destijds de grootste arbeidersstad van Vlaanderen. Geen wonder dat tegen deze achtergrond de ‘rode’ arbeidersbeweging een gretige aanhang kende. Met bezoek aan Ons Huis.,18/07/2011,14:00,16:00,"MIAT, Minnemeers 9, Gent",0,50,51.0599955,3.7287123
"Havenrondvaarten met het havenjacht ""Jacob van Artevelde""","Ga tijdens de Gentse Feesten mee op verkenning in de haven. We starten aan de Rigakaai en varen helemaal tot aan ArcelorMittal.  U maakt kennis met alle dokken en met alle belangrijke spelers zoals oa Volvo, Stora Enso, Bio Base Europe, enz",18/07/2011,14:30,16:00,"Rigakaai - tegenover WEBA, Rigakaai 0375, Gent",1,100,51.05665,3.72
Historische rondvaart doorheen het middeleeuwse centrum + gratis ijsje. Duur: 50 min.,Gent centrum per boot. Gids aan boord. Om de 15 minuten vertrekt er een boot.,18/07/2011,10:00,00:00,"Aanlegsteiger Boat in Gent, bij Gravensteen (50m), Kraanlei , Gent",0,1000,51.0569531,3.7226146
Crea-atelier & volksspelen - dag 2,Met gerecycleerde materialen een leuke auto of een prachtig boeket bloemen maken. Creativiteit troef! Diverse volksspelen met daaraan verbonden een kleine verrassing.,18/07/2011,14:45,16:15,"Landgoed De Campagne, Gijzelstraat 12, Drongen",0,50,51.0671875,3.6295947
"Radio 2 animatie in en voor de mobiele studio (locatie : voor stadhuis, in het hart van de Gentse Feesten)","loop eens langs , en ontmoet ons radio-team en hun Gentse Feesten gasten",18/07/2011,15:00,22:00,"Botermarkt, afspraak aan de trappen voor het stadhuis, Botermarkt z/n, Gent",0,50,51.05665,3.72
Circusworkshops voor kinderen (6-12 jaar),"Wil je zelf circusartiest worden? Dat kan! Onder ervaren begeleiding van Circusplaneet kan je gratis allerlei zotte circustechnieken uitproberen: luchtacrobatie, jongleren, diabolo, ... Gelieve vooraf in te schrijven aan het onthaal.",18/07/2011,15:00,18:00,"Baudelopark, Bibliotheekstraat 7, Gent",0,50,51.0578349,3.7294696
Casa Bordo,"Voklstoneel-komedie in drie bedrijven van Lea Van Volsem. In 't Gents In ""De Buurtlloods"" Patrijsstraat 10, Gent. Mariette wordt de erfgename van een heel speciale erfenis .",18/07/2011,19:30,22:30,"De Buurtloods,, Patrijsstraat 10, Gent",0,50,51.0742429,3.7324861
Broodje Gent: Culinair Patershol,Wil je eens iets anders dan saaie boterhammen uit je brooddoos? Laat je dan verleiden door Broodje Gent. Wij bezorgen je een originele middagpauze en nemen je twee uurtjes mee het Patershol in.,18/07/2011,12:00,14:00,"Infostand Vizit, Corduwaniersstraat 4, Gent",0,50,51.0576395,3.7227266
Koninklijke Harmonie Amicitia Eeklo,Harmonie,18/07/2011,11:00,13:00,"Het Huis van Alijn, Kraanlei 65, Gent",0,1000,51.0574921,3.7234722
Vier zonder ruuk deur 't Spelleke van Dei Kluite,"Een nieuwe revue, veur alle  gruute kientsjes die Gent kenne en Gents verstoan mee stijte muile Pierke Pierlala in d'uuftrolle.",18/07/2011,22:00,23:30,"Lakenmetershuis/Willemsfonds -Vrijdagsmarkt, Vrijdagmarkt 24-25, Gent",1,1000,51.0569408,3.7264272
Wandelzoektocht Pasar Gent - Eeklo vzw,"De 17e editie van de Wandelzoektocht van Pasar laat je kennismaken met interessante gebouwen en bezienswaardigheden waarbij werknemers centraal staan. Kortom, een boeiende en plezante uitstap voor het ganse gezin!",18/07/2011,00:00,00:00,"Startplaats, Sint-Michielsplein , Gent",0,50,51.0534201,3.719132
Belcanto-ontbijt in het Huis van Alijn,Geniet in de binnentuin van een lekker ontbijt met een streepje muziek. Keuze tussen een Belcanto-ontbijt (€ 7) en een Belcanto-Royal-ontbijt (mét bubbels - € 10). Welkom tussen 10 en 12 uur! Graag aanmelden vanaf 10 pers. Dit is echter geen reservatie.,18/07/2011,10:00,12:00,"Het Huis van Alijn, Kraanlei 65, Gent",0,1000,51.0574921,3.7234722
"Café Cantant, Willy Bart en zijne kluts : optreden","Nen hutsepot van Gentsche liedjes mee Willy Bart, Pat Remue & Sabien",18/07/2011,12:30,14:30,"Bretoens Pannenkoekenhuis Gwenola, Donkersteeg 16, Gent",1,100,51.0546855,3.723231
Design van 1880 tot vandaag,"De collecties 20ste-eeuwse en hedendaagse vormgeving in het Design museum Gent zijn meer dan een ommetje waard. U kan kennismaken met ontwerpen van Van de Velde, Rietveld, Hoffmann, Mendini, Van Severen, Arad, ....",18/07/2011,10:00,18:00,"Design Museum Gent, Jan Breydelstraat 5, Gent",0,1000,51.0556456,3.7202583
Natte stadswandeling met Lunch i.s.m. Rederij De Gentenaer,"Nieuwe unieke, folklorische wandeling in de stad van Gent met Dille. Of op afspraak !",18/07/2011,10:30,13:30,"A Capella Kaffee, Godshuizenlaan 33, Gent",0,50,51.0432035,3.7165927
Tentoonstelling van 12 litho's van Willem Vermandere geïnspireerd op de Statenbijbel,"Een rustpunt in de drukte, stilte en meditatie, rond 12 houtsneden van Willem Vermandere, tentoongesteld in een voormalige Capucijnenkapel (17e eeuw). Alle dagen open van 14u tot 18u. Meditatieve concerten op 17, 19, 21 en 23 juli, aanvang 17u.",18/07/2011,14:00,18:00,"Protestantse kerk Gent-Centrum, Brabantdam , Gent",0,50,51.0501111,3.7300653
Broodje bakken,"De kinderen gaan zelfs hun deeg maken, kneden en versieren. Als het broodje gabakken is nemen ze het mee",18/07/2011,13:30,15:00,"Schoolhoeve de Campagne, Gijzelstraat 14, Drongen",0,1000,51.0667128,3.6297347
Flipke Flap,Flipke heeft een grote mond en is van niets bang. In het park haalt hij allerhande kattekwaad uit. Flipke wordt echter meegelokt door de wolf. Maar Pierke en zijn vrienden grijpen in.,18/07/2011,15:00,16:30,"Het Huis van Alijn, Kraanlei 65, Gent",0,1000,51.0574921,3.7234722
Rondleidingen in de Etnografische Verzamelingen: Levenswijsheid en geluk! Verrassende voorwerpen uit het traditionele China,Enthousiaste gidsen vertellen bijzondere verhalen over voorwerpen uit het vroegere China. Ga mee op avontuur in de rijke wereld van de Aziatische cultuur en kom in contact met de oosterse wijze van denken en leven en raak vertrouwd met hun esthetiek.,18/07/2011,15:00,16:30,"Het Pand, Onderbergen 1, Gent",0,50,51.052799,3.7198035
Stadhuis van Gent,Geleid bezoek aan het Stadhuis met aandacht voor Rechtspraak en Gerechtigheid. In samenwerking met de Dienst Monumentenzorg en Architectuur. Inschrijven niet nodig.,18/07/2011,15:30,16:25,"Stadhuis, Botermarkt 1, Gent",0,50,51.0545313,3.7253208
Movieguide Filips en Mathilde,Het Gravensteen is een van de topmonumenten van Gent. Via de movieguide ‘Filips en Mathilde’ komt het verre en bewogen verleden van deze versterkte burcht werkelijk tot leven.,18/07/2011,09:00,18:00,"Gravensteen, Sint-Veerleplein , Gent",0,50,51.05665,3.72
Travestieshow Feerie au paradis,"Travestieshow maar op zijn parijse wijze met pluimen strass pailletten .Met prachtige  kostuums zoals in de moulin rouge,glamour numers,comische acts,prachtig   decor,sfeervolle zaal.En dit jaar md zaza en haar dancers erbij!",18/07/2011,20:30,23:30,"de kring, Sint-Godelievestraat 59, Wondelgem",1,100,51.0788791,3.7131195
Tangram en andere traditionele kinderspelletjes uit China in de Etnografische Verzamelingen,TANGRAM is een Chinees legspel waarbij figuren kunnen worden gevormd uit geometrische stukken. Met zo’n puzzelstuk in de hand speuren en spelen tussen de museumstukken en in de omsloten kloostertuin.   Ouders zijn welkom!,18/07/2011,11:00,12:30,"Het Pand, Onderbergen 1, Gent",0,50,51.052799,3.7198035
Gent op z'n kookpunt (zoektocht zonder gids),"Wat zat er vroeger in de kookpot? Waarom gebruiken we eigenlijk bestek? Hoe ontstond Gentse waterzooi? Boekje te koop: Kunstglasramen Mestdagh, Drabstraat 2.",18/07/2011,00:00,00:00,"Korenlei /, Gent",0,50,51.054856,3.7201238
Damiaan,"Jo Decaluwe speelt ‘Damiaan”, een zeer persoonlijke visie op deze man van inzet, geloof, moed, tegenslag, succes.",18/07/2011,11:00,12:10,"Tinnenpot, Tinnenpotstraat 21, Gent",1,50,51.0583441,3.7183287
The Julian's N.O. Jazzband (B),Oude stijl Jazz,18/07/2011,20:00,01:00,"Lazy River Jazz Club vzw, Stadhuissteeg 5, Gent",1,1000,51.0542133,3.7242079
"Theater op het water i.s.m. theater Trac - ""Ganda Historica""","De toeschouwers worden per open boot naar de acteurs gebracht.Met ""Ganda Literatura"" wordt aandacht besteed aan de Gentse schrijvers Maurice Maeterlinck, Jean Ray, Cyriel Buysse,gezusters Loveling.   Prijs : € 10,00/pers.Reservatie verplicht.",18/07/2011,18:30,19:30,"Aanlegsteiger Gent Watertoerist, Graslei , Gent",0,50,51.05471,3.72076
Saskia De Ceuninck,Voor het derde jaar op rij creëerde actrice-regisseuse Saskia De Ceuninck een stuk op maat van café de loge. Ze brengt haar performance tussen de cafégasten,18/07/2011,20:30,21:30,"café de loge, Annonciadenstraat 5, Gent",1,50,51.0499472,3.7169582
Rondleidingen in de Etnografische Verzamelingen: Levenswijsheid en geluk! Verrassende voorwerpen uit het traditionele China,Enthousiaste gidsen vertellen bijzondere verhalen over voorwerpen uit het vroegere China. Ga mee op avontuur in de rijke wereld van de Aziatische cultuur en kom in contact met de oosterse wijze van denken en leven en raak vertrouwd met hun esthetiek.,18/07/2011,11:00,12:30,"Het Pand, Onderbergen 1, Gent",0,50,51.052799,3.7198035
De Piratenboot + gratis ijsje. Duur 40 min.,Maat Piraat springt aan boord want boeven zitten hem op de hielen. We gaan per boot op zoek naar een geheime schat en hij vertelt onderweg geweldige verhalen over zijn wedervaren om zijn droom te vervullen...,18/07/2011,17:00,17:40,"Aanlegsteiger Boat in Gent, bij Gravensteen (50m), Kraanlei , Gent",0,1000,51.0569531,3.7226146
"Anders durven bewegen, voelen, denken?",#NAAM?,18/07/2011,11:00,12:30,"Feldenkrais Gent, Kliniekstraat 69, Gentbrugge",1,50,51.0410004,3.7546023
Rondleidingen in Hotel d'Hane Steenhuyse,Uitzonderlijk kan het Hotel d'Hane Steenhuyse - een 18de-eeuws stadspaleis - onder begeleiding van een gids worden bezocht.,18/07/2011,16:00,17:00,"Hotel d'Hane Steenhuyse, Veldstraat 55, Gent",1,100,51.0515844,3.7214225
Levenswijsheid en geluk! Verrassende voorwerpen uit het traditionele China in de Etnografische Verzamelingen,"Een tijdelijke presentatie van kleurrijke kimono's, kunstige kalligrafieën, mysterieuze miniatuurtheatertjes en andere betoverende authentieke voorwerpen die oosterse ideeën over geluk en wijsheid verbeelden. Maak kennis met boeiende Chinese kunst.",18/07/2011,11:00,17:00,"Het Pand, Onderbergen 1, Gent",0,50,51.052799,3.7198035
Luk Vincentprijs voor jong Talent,"Jong Talent, Voorstelling van beginnende figurentheaterspelers",18/07/2011,15:00,15:30,"Binnenkoer Europees Figurenteatercentrum, Trommelstraat 1, Gent",0,1000,51.0585945,3.7231493
Nosedrip (BE),"Een visionaire mix van future dubstep, leftside hiphop, broken house en warme retro electronica met Duyster-feel. Nu al een cultheld in middens van jonge creatieve multimediacollectieven als Mac Fly, Villa Bota, GentM en Release.",18/07/2011,23:00,05:55,"10 Days Off - Vooruit, Sint-Pietersnieuwstraat , Gent",0,5000,51.05665,3.72
Elga - Het Panopticum,Elga – Het Panopticum dompelt jou onder in de historiek van Gent waar revolutionaire figuren het voortouw namen. Dit levend museum vind je op de speelplaats van het SKI palend aan het Baudelohof. Een productie in samenwerking met het Vermeylenfonds.,18/07/2011,18:00,18:40,"secundair kunstintituut - speelplaats - ingang via Baudelohof, Ottogracht 4, Gent",0,50,51.0580378,3.7279839
Liquid Love Hotel,Een koppel van middelbare leeftijd ontmoet een tegendraads hoertje en een gigolo van weinig woorden. Verborgen agenda’s en een broek vol goesting maken van Liquid Love Hotel een bij momenten hilarische tragikomedie die ook tot nadenken stemt.,18/07/2011,20:30,22:05,"NTGent Arca, Sint-Widostraat 4, Gent",1,1000,51.0574957,3.7195404
Tentoonstelling H²O van Mark Swysen,"Op de plaats waar zich in de vroege Milldeeeuwen de waterput van de Sint-Baafsabdij bevond, stelt Mark Swysen enkele installaties tentoon die het begrip ""water"" oproepen in al zijn aspecten: bron van leven én stervensgevaar.",18/07/2011,15:00,18:00,"Machariuskerk, Sint-Machariusstraat 1, Gent",0,50,51.0554365,3.7358552
"Rhythm & Beast (Le BoTrio, BE)",Drie onopvallende burgers komen samen om hun alledaagse leventje even te vergeten. Gedreven door het ritme van hun hart transformeren ze in knotsgekke 'beasts' die oerdegelijke jongleerkunsten op de trampoline uithalen. Spectaculaire fun voor iedereen!,18/07/2011,16:00,16:30,"Baudelopark, Bibliotheekstraat 7, Gent",0,1000,51.0578349,3.7294696
Elga - Het Panopticum,Elga – Het Panopticum dompelt jou onder in de historiek van Gent waar revolutionaire figuren het voortouw namen. Dit levend museum vind je op de speelplaats van het SKI palend aan het Baudelohof. Een productie in samenwerking met het Vermeylenfonds.,18/07/2011,21:00,21:40,"secundair kunstintituut - speelplaats - ingang via Baudelohof, Ottogracht 4, Gent",0,50,51.0580378,3.7279839
Cursus locatietheater op de Gentse Feesten,"Stel je een levend beeldverhaal voor, midden in de bruisende sfeer van de feesten… géén woorden, wel beweging, handeling, kostuum, gemurmel en gezang. Op vijf namiddagen maken we een presentatie en toetsen die aan het publiek.",18/07/2011,14:00,18:00,"WiSPER vzw, Warandestraat 13, Gent",1,50,51.0572684,3.7372265
Wiegel Waggel Web,Dot heeft een computer waaraan ze haar diepste geheimen toevertrouwt. Dan ontdekt Dot een manier om in de computer te stappen. Daar komt ze meer te weten over hoe deze er vanbinnen uitziet. Jammer genoeg ligt er een piraat op de loer…,18/07/2011,15:00,15:45,"Theater Tinnenpot, Tinnenpotstraat 21, Gent",1,50,51.0583441,3.7183287
Lancelot & Genoveva,Een amateur gezelschap krijgt een opdracht van een Vlaamse Televisie zender om een middeleeuws spektakel te brengen. Zij hebben één week de tijd om dit te realiseren. Al gauw lopen de repetities in het honderd. Auteur & Regie: Frans De Bruyckere,18/07/2011,19:30,22:00,"Kring Heilig Hart, Heilig-Hartstraat 2, Sint-Amandsberg",1,1000,51.0538634,3.7490044
'Materiële armoede en culturele rijkdom in Afrika' een boeiende ontdekking in de Etnografische Verzamelingen!,In de media wordt het beeld over Afrika bepaald door het cliché van de armoede. Deze expo toont dat Afrikanen creatief zijn in het zoeken van oplossingen om materiële armoede te overstijgen.,18/07/2011,11:00,17:00,"Het Pand, Onderbergen 1, Gent",1,50,51.052799,3.7198035
Ka-Bal: danstheater met live muziek,"Ka-Bal combineert live muziek met dans in telkens drie korte voorstellingen per avond, gebracht door een schare Belgische en internationale artiesten voor wie geen uitdaging te veel is.",18/07/2011,20:00,21:00,"Minnemeers (NT2Gent), Minnemeers 9, Gent",0,50000,51.0599955,3.7287123
Middeleeuws ontbijt en Ontbijt bij Lieven Bauwens,"Een arm en een rijk ontbijt, een ontbijt bij Lieven Bauwens. En nieuw dit jaar: een kinderontbijt! Steeds een goede start voor een dag Gentse Feesten. Geen reservatie mogelijk. Wie voor 11.30 uur aanwezig is, wordt zeker bediend. Prijs €5, €9 of €11.",18/07/2011,08:30,11:30,"MIAT, Minnemeers 9, Gent",0,1000,51.0599955,3.7287123
Workshops voor kinderen in de Etnografische Verzamelingen,Kruip in de huid van een heuse ontdekkingsreiziger. Verken de wereld aan de hand van voorwerpen en verhalen.   Speel spelletjes van verre volkeren. Zo kom je te weten hoe kinderen zich daar amuseren en groot worden. Ouders welkom. Schrijf tijdig in!,18/07/2011,15:00,16:00,"Het Pand, Onderbergen 1, Gent",0,50,51.052799,3.7198035
"Hemadi, een kleine geschiedenis","In zijn 'kleine geschiedenis' brengt Hemadi de sporen van zijn vroegste kennismaking met de westerse cultuur, opgetekend in café op voorhanden zijnde bierkaartjes. Deze zeer spontaan tot stand gekomen schetsen werden veelal afgewerkt in het atelier.",18/07/2011,09:00,16:30,"lokettenzaal hoofdzetel VDK spaarbank, Sint-Michielsplein 16, Gent",1,50,51.0534253,3.7190681
Varkens Willen Haar,"Een leuke muziektheatervoorstelling voor mens en dier met stress, en een hart voor muziek! Een roze huid, een scherpe geest, sociale codes. Dat hebben mensen en varkens gemeen. Maar ook stress en liefde voor muziek...(zie ook www.xlp.be)",18/07/2011,22:00,22:55,"Theater Tinnenpot, Biljartzaal, Tinnenpotstraat 21, Gent",1,100,51.0583441,3.7183287
Expo Et Cetera,"Et Cetera staat voor textielkunst. Dit vrouwelijke collectief werkt met eeuwenoude technieken, zoals batikken, weven, vilten en shibori.",18/07/2011,10:00,18:00,"MIAT, Minnemeers 9, Gent",0,1000,51.0599955,3.7287123
Dj Moony,Bram Moony verwelkomt u in zijn Moonyuniversum.,18/07/2011,23:00,05:00,"Kinky Star, Vlasmarkt 9, Gent",0,50,51.0557895,3.7285385
"Enjoy and Jump (Acrobarouf, BE)","Spectaculaire en adembenemende show. Bascule, banquine en grondacrobatie doorspekt met flink wat publieksinteractie in een strak tempo. Humoristische en broederlijke zweefvlucht van een trio dat de komende twee jaar voor Cirque du Soleil speelt.",18/07/2011,18:00,18:20,"Baudelopark, Bibliotheekstraat 7, Gent",0,1000,51.0578349,3.7294696
Belleman Jean-Pierre Van De Perre,Belleman te zien in het straatbeeld is ter beschikking van de bevolking en feestvierders bij de rondgang van de stroppendragers.,18/07/2011,16:00,20:00,"Feestzone, Belfortstraat , Gent",0,50,51.055272,3.7266301
Open en Bloot,"We snuisteren in andermans brieven, loeren door het sleutelgat en komen zo alles te weten over het privéleven en de zoektocht naar privacy vroeger en nu. ...someone is watching you!",18/07/2011,16:00,17:30,"Infostand Vizit, Corduwaniersstraat 4, Gent",0,50,51.0576395,3.7227266
De generaelen staet van een goede famielde in Gent,Het publiek maakt enkele scènes mee uit het leven van graaf en gravin d'Hane de Steenhuyse en hun personeel in 1808.,18/07/2011,10:30,12:30,"Hotel d'Hane Steenhuyse, Veldstraat 55, Gent",1,50,51.0515844,3.7214225
Diafaan V. Hedendaagse glaskunst in het Sint-Elisabethbegijnhof te Sint-Amandsberg,"Rondleiding in de tentoonstelling 'Diafaan V' waarbij op verschillende locaties in het begijnhof van Sint-Amandsberg, die voor de gelegenheid opengesteld zijn, glaskunstenaars hun werk tentoon stellen.",18/07/2011,15:00,17:00,"Begijnhofkerk Sint-Elisabeth, Groot Begijnhof 67, Sint-Amandsberg",0,50,51.0565888,3.7466023
Prinses gezocht,Actrices Niki De Sitter & Léonthine van Wassenhove sloegen voor ‘Prinses gezocht’ de handen in elkaar en werkten een kindervoorstelling van de bovenste plank uit!,18/07/2011,15:00,16:00,"Bij' De Vieze Gasten, Haspelstraat 31, Gent",1,100,51.0583924,3.7022031
Het nieuwe gerechtsgebouw,Gedurfde architectuur en industriële en historische relicten ontmoeten elkaar in en rond het nieuwe gerechtsgebouw.,18/07/2011,11:00,13:00,"Gerechtsgebouw, Opgeëistenlaan 401, Gent",0,50,51.0609602,3.7132777
"Cartoontentoonstelling ""Selecte (Gentsche) humor""",Gentse e.a. cartoonisten stellen voor uit hun eigen werk.,18/07/2011,11:00,15:00,"Hof Van Ryhove, Onderstraat 20, Gent",1,100,51.0559253,3.7251237
Het Zwaard van Koning Arthur - poppentheater met Pierke,"Pierke gaat terug in de tijd en beleeft een spannend avontuur bij koning Arthur en tovenaar Merlijn! Alle klassieke Pedrolino-ingrediënten zijn aanwezig: een boeiend verhaal, humor, prachtige poppen en sfeervolle decors!",18/07/2011,15:00,16:30,"Gravensteen, Sint-Veerleplein , Gent",1,1000,51.05665,3.72
'En Het Grootste Deel Schreven we Samen in Bed',"Voor het vierde jaar op rij brengt het Gentse dichterscollectief 'De Wolven van La Mancha' tien dagen lang een poëtische oase in het hart van de binnenstad. Een plek waar woord en beeld voor verwondering zorgen: uitdagend, bloedstollend mooi en gratis.",18/07/2011,17:00,02:00,"Los Perros Calientes, Goudstraat 2, Gent",1,50,51.0596007,3.7277249
"CONFLICTEN: Noormannen, Kruistochten, Tempeliers","De Noormannen brandschatten de nederzettingen en de abdijen. In de ontluikende stad bouwt men de eerste versterking. Vlamingen trekken mee op Kruistocht. De Tempelorde ontstaat, vanuit Gent gesteund door Zeger II. Rondleiding, reserveren niet nodig.",18/07/2011,14:30,16:30,"Sint-Baafsabdij, Groene Kerk, Voorhoutkaai , Gent",0,50,51.0542212,3.7352485
"Havenrondvaarten met het havenjacht ""Jacob van Artevelde""","Ga tijdens de Gentse Feesten mee op verkenning in de haven. We starten aan de Rigakaai en varen helemaal tot aan ArcelorMittal.  U maakt kennis met alle dokken en met alle belangrijke spelers zoals oa Volvo, Stora Enso, Bio Base Europe, enz",18/07/2011,16:30,18:00,"Rigakaai - tegenover WEBA, Rigakaai 0375, Gent",1,100,51.05665,3.72
Ontbijt,"Uitgebreid ontbijtbuffet (verse koeken, broodjes, omeletten, spek, fruitsap, koffie, thee enz...) Reservatie bevestigd bij betaling en afhaling kaarten. Zitplaatsen verzekerd !",18/07/2011,09:00,10:15,"Brasserie Het Volk, Poel 7, Gent",0,50,51.0545335,3.7178529
Mijn Ferme Lady,"Muzikale komedie van Romain Deconinck, in regie van Geert Callebaut. Met o.a. Betty Bouckaert, Manon Soberon, Alain Devos, Lia De Cuyper, Guido Van den Berghe, Patrick Pevenage, Johan Van Hoorde, Steffi Ramont, Marc De Bruycker, Marc Scheire. Première 14 juli om 20u",18/07/2011,14:00,16:30,"Theater SCALA, Dendermondsesteenweg 163-165, Gent",1,5000,51.0524071,3.7533519
