La ville qui respire - Rode Boom (BE) - € 6,"‘La ville qui respire’ is een wandelvoorstelling waarbij een gids met behulp van poëtische zoekers u de stad toont. U neemt de tijd om alledaagse dingen in een andere context te zien. Gent, door de ogen van een poëet.",24/07/2011,15:30,16:15,"Sint-Baafssite, Gandastraat , Gent",0,50,51.0537966,3.7384238
Openluchtatelier/kunstmarkt,"Openluchtatelier met demonstaties van verschillende beeldende kunstenaars   (tekenaars,schilders,portrettekenaars,karikarturen enz.)",24/07/2011,10:00,19:00,"Groentenmarkt, Gent",0,50,51.0559826,3.7223147
Museumspel KidKastKraak,Aan de hand van 3 koffers en een kast verkennen de leerlingen de expo WereldWijdWerken. Zij zijn gevuld met bezittingen van Kristel en haar grootouders. Elk voorwerp stuurt de kinderen op pad. Vanaf 6 jaar.,24/07/2011,10:00,18:00,"MIAT, Minnemeers 9, Gent",0,50,51.0599955,3.7287123
Vieze Verol Tjes - Compagnie KAiET (BE) - € 9,‘Witte Peper’ is het eerste deel van Geert Hautekiet’s Trilogie van de Vieze Verol Tjes. Een meesterlijke eenmansshow van muzikale vertellingen rond vieze verhaaltjes.,24/07/2011,20:30,22:00,"Sportschuur, Regattenlaan 8, Gent",0,50,51.0595068,3.7338161
De Mannen,Het sluitstuk van de trilogie ‘de Soprano’s van Ledeberg',24/07/2011,20:00,21:30,"Minardschouwburg, Walpoortstraat 15, Gent",0,50,51.048845,3.7270658
Markt in voedingswaren - Sint-Michielsplein,Markt in voedingswaren,24/07/2011,07:30,13:00,"Sint-Michielsplein, Sint-Michielsplein , Gent",0,50,51.0534201,3.719132
Sucer Danser,"Elektroparty - DJ's: Who Are We, Headz'Up",24/07/2011,22:00,00:00,"Tijuana, Schuurkenstraat 2, Gent",1,1000,51.0534682,3.7217767
Carlos Rodriguez-Méndez | Agua Caliente/Hot Water,De Spaanse kunstenaar Carlos Rodríguez-Méndez plaatst een reusachtige minimale sculptuur in de Kunst Nu-ruimte van S.M.A.K.,24/07/2011,10:00,18:00,"S.M.A.K., Citadelpark 2, Gent",0,50,51.05665,3.72
Dag                                       Figurentheater voor kleuters,"Zoveel saaie dagen? Waarom is het niet elke dag mijn verjaardag,Pasen of Nieuwjaar? Titiana ontmoet Dageraad en ze beslissen om van elke dag een ""superdag "" te maken!(drankje incl.)  Tekst;Lien Maes  Regie:Hilde Heÿnen en Alain Pringels",24/07/2011,14:00,14:45,"Capitole - kleine zaal, Graaf van Vlaanderenplein 5, Gent",0,50,51.0480347,3.7319393
Filmvoorstelling 'The Age of STUPID',"THE AGE OF STUPID    De grootste klimaatfilm sinds ""An Inconvenient Truth""",24/07/2011,15:30,17:00,"Augustijnenklooster Sint-Stefanus, Academiestraat 1, Gent",1,50,51.0593912,3.7198089
Boe-K!,"Het is bedtijd, maar Kaat kan echt niet slapen. Ze is haar lievelingsboek kwijt. Daaruit lezen mama of papa altijd een verhaaltje voor en dan valt ze bijna altijd meteen in slaap. Maar nu dus niet.",24/07/2011,15:00,16:00,"Tinnenpot, Tinnenpotstraat 21, Gent",0,100,51.0583441,3.7183287
Family,Barbaar: Met Dj's Just Nathan & Sixsixsixties vs. Christopher & Collect-Ief De Ruyter,24/07/2011,00:00,05:55,"Charlatan, Vlasmarkt 6, Gent",1,1000,51.0560619,3.7282741
MiramirO laat je vliegen - Aérosculpture (FR) - € 3 (ter plaatse),De Aéroplume komt naar Gent! Op 21 juli 2011 tonen de mannen van Aérosculpture hoe het moet. De volgende dagen mogen kinderen zelf vliegen met de zeppelin in ’t Kuipke. Gewoon komen kijken kan natuurlijk ook!,24/07/2011,14:00,18:00,"'t Kuipke, Citadelpark z/n, Gent",0,50,51.05665,3.72
AUDIOGIDSEN GRATIS - volwassenen en kinderen,Audiogidsen GRATIS voor volwassenen en kinderen tijdens GF,24/07/2011,10:00,18:00,"Museum voor Schone Kunsten, Citadelpark , Gent",0,50,51.05665,3.72
Luc Devos,Muziek,24/07/2011,11:30,12:30,"Lakenhalle, Sint-Baafsplein , Gent",1,100,51.0536709,3.7254561
Het Museumspel,"Het jonge volkje ontdekt op een heel speelse en ludieke manier de collectie van het Design museum Gent. Gewapend met verrekijker, materialenketting en boekje gaan ze, samen met hun ouders, op designontdekkingstocht.",24/07/2011,10:00,18:00,"Design Museum Gent, Jan Breydelstraat 5, Gent",0,1000,51.0556456,3.7202583
La ville qui respire - Rode Boom (BE) - € 6,"‘La ville qui respire’ is een wandelvoorstelling waarbij een gids met behulp van poëtische zoekers u de stad toont. U neemt de tijd om alledaagse dingen in een andere context te zien. Gent, door de ogen van een poëet.",24/07/2011,19:15,20:00,"Sint-Baafssite, Gandastraat , Gent",0,50,51.0537966,3.7384238
Alleen om te lachen,"Na de succesvolle tournee met Chris Van den Durpel speelt Vlaanderens vrolijkste poppenspeler, helemaal alleen. Jean-Pierre laat oude en nieuwe typetjes zien die één ding met elkaar gemeen hebben, ze zijn allemaal alleen. Een avondvullend spektakel",24/07/2011,20:30,23:00,"Groenzaal, Lange Boomgaardstraat , Gent",1,1000,51.0511483,3.7313765
Merkwaardige Bomenwandeling door Gent,Tijdens de merkwaardige bomenwandeling tronen we u mee naar bijzondere groenplekjes en bomen in Gent.,24/07/2011,15:00,16:20,"ingang Baudelopark, Bibliotheekstraat 1, Gent",0,50,51.0578952,3.7295798
Waxdolls,Zaal: Vettige Electropunk in de stijl van Goose & Nid & Sancy – met de veelbesproken single en clip Dingeling King,24/07/2011,22:00,23:00,"Charlatan, Vlasmarkt 6, Gent",1,1000,51.0560619,3.7282741
Outsiders: kunst in de marge,"De werelden van kunst en waanzin hebben elkaar doorheen de geschiedenis met regelmaat geïnspireerd. Outsiderkunstenaars maken eigenzinige omzwervingen door de wereld van kunst, esthetiek en creativiteit.",24/07/2011,13:00,17:00,"Museum Dr. Guislain, Jozef Guislainstraat 43, Gent",1,100,51.0662256,3.702715
Expo 'WereldWijdWerken',"Beleef de gevolgen van de industrialisatie. Felix, Aline en Monica komen uit een grote familie. Zij nemen je mee doorheen de expo en vertellen over de turbulente veranderingen in deze periode. Met filmfragmenten en luisterposten.",24/07/2011,10:00,18:00,"MIAT, Minnemeers 9, Gent",0,100,51.0599955,3.7287123
Beeldige Borsten,"Met de borst vooruit wandelen we langs talloze beelden en afbeeldingen van vrouwen. We zoeken naar schoonheidsidealen vroeger en nu, naar leuke verhalen over opsmuk en geven jullie graag historisch verantwoorde schoonheidstips mee.",24/07/2011,14:00,15:30,"Infostand Vizit, Corduwaniersstraat 4, Gent",0,50,51.0576395,3.7227266
Historische rondvaart doorheen het middeleeuwse Gent + gratis ijsje. Duur: 40 min.,"Rondvaart met gids op Leie en Lieve. Om de de 15 minuten vertrekt er een bootje. Reservatie: niet nodig, tenzij voor groepen.",24/07/2011,10:00,00:00,"Aanlegsteiger De Bootjes van Gent-Rederij Dewaele, Korenlei , Gent",0,1000,51.054856,3.7201238
Hans Mortelmans & Groep,"Hans Mortelmans & Groep is een akoestisch kwartet, in 2005 gevormd rond de liedschrijver-gitarist Hans Mortelmans. Stijl: Wannes Van de Velde, Georges Brassens en Django Reinhardt.",24/07/2011,20:00,21:00,"Monasterium Poortackere, Oude Houtlei 56, Gent",0,1000,51.0522058,3.7169339
Age Of Love,"Zaal: House & techno klassiekers met Mr Phonic, Olivier Pieters & Fred Nasen",24/07/2011,01:00,05:55,"Charlatan, Vlasmarkt 6, Gent",1,1000,51.0560619,3.7282741
La ville qui respire - Rode Boom (BE) - € 6,"‘La ville qui respire’ is een wandelvoorstelling waarbij een gids met behulp van poëtische zoekers u de stad toont. U neemt de tijd om alledaagse dingen in een andere context te zien. Gent, door de ogen van een poëet.",24/07/2011,18:45,19:30,"Sint-Baafssite, Gandastraat , Gent",0,50,51.0537966,3.7384238
Diafaan V. Hedendaagse glaskunst in Vlaanderen,"'Diafaan' is een biënale tentoonstelling over hedendaagse glaskunst in Vlaanderen die voor de vijfde keer plaatsvindt in het Begijnhof van Sint-Amandsberg. In het hof worden op verschillende plaatsen, binnen en buiten, werk van kunstenaars getoond.",24/07/2011,13:00,18:00,"Begijnhof Sint-Amandsberg, Jan Roomsstraat , Sint-Amandsberg",0,100,51.0584416,3.7498916
Images of Villages - Scuba Club Collective (BE-SL),‘Images of Villages’ is een voorstelling over de creatie van een klein dorp in de stad. Scuba Club Collective geeft het publiek een zintuiglijke belevenis en gaat met hen terug in de tijd.,24/07/2011,19:30,20:15,"Spaanskasteelplein , Gent",0,50,51.0543133,3.7382505
Kwartet,"Komedie van Ronald Harwood (auteur van o.a. The Pianist en The Dresser)over 4 gewezen operazangers. In regie van Werther Van Der Sarren. Met Lien Van Ginderachter, Betty Bouckaert, Geert Callebaut en Marc Scheire.",24/07/2011,14:00,16:30,"Theater SCALA, Dendermondsesteenweg 163-165, Gent",1,1000,51.0524071,3.7533519
Van gekleutst ei tot Woaterzeuij de luukse,Een boeiende introductie in de Gentse keuken en haar woordenschat,24/07/2011,16:00,17:15,"Lakenmetershuis/Willemsfonds -Vrijdagsmarkt, Vrijdagmarkt 24-25, Gent",1,100,51.0569408,3.7264272
New Orleans Jazz met The Rudy Balliu  Society Serenaders,"Echte,zuivere New Orleans Jazz",24/07/2011,20:00,00:00,"Zaal van K. Roeivereniging Sport Gent, Kanodreef 1, Gent",1,100,51.0475162,3.7036577
Moederkeszalf,"Iedereen heeft een moeder.  Dikke moeders, dunne moeders, lange en korte, lieve, té lieve en ook iets minder lieve.  Moeders die er zijn, moeders die er waren en moeders die er nooit zijn geweest.  Een kleine prettige voorstelling over al deze moeders.",24/07/2011,15:00,16:20,"Jan Van Gent, Annonciadenstraat 1, Gent",1,50,51.0499958,3.7171458
Carrousel des moutons - D'Irque en Fien (BE),Een intieme voorstelling zonder woorden die je sprakeloos maakt voor kinderen en andere volwassenen. D'Irque en Fien nemen je mee naar wonderland waar ze je hun dromen onthullen.,24/07/2011,20:30,21:30,"Sint-Baafssite, Gandastraat , Gent",0,1000,51.0537966,3.7384238
Tangram en andere traditionele kinderspelletjes uit China in de Etnografische Verzamelingen,TANGRAM is een Chinees legspel waarbij figuren kunnen worden gevormd uit geometrische stukken. Met zo’n puzzelstuk in de hand speuren en spelen tussen de museumstukken en in de omsloten kloostertuin.   Ouders zijn welkom!,24/07/2011,14:00,15:30,"Het Pand, Onderbergen 1, Gent",0,50,51.052799,3.7198035
Smeltkroes van culturen,"Deze wandeling geeft een beeld van het multiculturele oude Gent. Gent is altijd een poort op Europa en de wereld geweest, daarvan zijn vele getuigen terug te vinden. Deze wandeling eindigt in de Orthodoxe kerk die geheel versierd is met fresco’s.",24/07/2011,14:00,16:30,"Café Trefpunt, Bij Sint-Jacobs 18, Gent",0,50,51.0562813,3.7271842
Expo 'Ons industrieel verleden',"Duik 250 jaar terug in de tijd. Vergeet alle technologische toepassingen, zoals gsm, computer en ipod. Je belandt in de 18e eeuw en komt vervolgens in de periode van de 1e industriële revolutie met de opkomst van de machine.",24/07/2011,10:00,18:00,"MIAT, Minnemeers 9, Gent",0,100,51.0599955,3.7287123
Casa Bordo,"Voklstoneel-komedie in drie bedrijven van Lea Van Volsem. In 't Gents In ""De Buurtlloods"" Patrijsstraat 10, Gent. Mariette wordt de erfgename van een heel speciale erfenis .",24/07/2011,15:00,18:00,"De Buurtloods,, Patrijsstraat 10, Gent",0,1000,51.0742429,3.7324861
Matchbox on Tour,"Twee verschillende kunstenaars : Nina Stoupina en Conny Kuilboer onderlegt in verschillende disciplines, elk met andere etnische wortels, andere vormen van beelexpressie. De matchbox staat gestationeerd aan het MIAT. Opening matchbox 17/7 om 14.30u",24/07/2011,14:30,20:00,"MIAT, Minnemeers 9, Gent",0,50,51.0599955,3.7287123
"Gent, rebelse stad!",Gent heeft altijd een dwars en rebels karakter gehad; Dit uitte zich in vele opstanden en oproeren tegen externe en interne machthebbers. In deze wandeling tonen we u aan dat Gent inspiratie geweest is voor nieuwe vormen om het gezag te tarten.,24/07/2011,14:00,16:00,"Café Trefpunt, Bij Sint-Jacobs 18, Gent",0,50,51.0562813,3.7271842
La ville qui respire - Rode Boom (BE) - € 6,"‘La ville qui respire’ is een wandelvoorstelling waarbij een gids met behulp van poëtische zoekers u de stad toont. U neemt de tijd om alledaagse dingen in een andere context te zien. Gent, door de ogen van een poëet.",24/07/2011,19:45,20:30,"Sint-Baafssite, Gandastraat , Gent",0,50,51.0537966,3.7384238
"Havenrondvaarten met het havenjacht ""Jacob van Artevelde""","Ga tijdens de Gentse Feesten mee op verkenning in de haven. We starten aan de Rigakaai en varen helemaal tot aan ArcelorMittal.  U maakt kennis met alle dokken en met alle belangrijke spelers zoals oa Volvo, Stora Enso, Bio Base Europe, enz",24/07/2011,14:30,16:00,"Rigakaai - tegenover WEBA, Rigakaai 0375, Gent",1,100,51.05665,3.72
Colyton Grammar School (UK - Devon),Orgel,24/07/2011,15:00,16:00,"Sint-Michielskerk, Sint-Michielsplein 1, Gent",0,1000,51.0535642,3.7187391
De Rabotwijk,Ontdek de Rabotwijk als een openluchtmuseum van 19de-eeuws industrieel erfgoed. Verder hebben we oog voor het multiculturele karakter van de wijk en de vele verborgen hoekjes en kantjes.,24/07/2011,11:00,12:30,"Standbeeld Keizer Karel, Prinsenhofplein -, Gent",0,50,51.0589935,3.7163865
Tentoonstelling Compostela,De figuur van Sint Jacob en de bedevaarten naar Compostela in het volksgeloof,24/07/2011,14:30,17:30,"Sint-Jacobskerk, Bij Sint-Jacobs , Gent",0,1000,51.0564691,3.7270706
De vijf zintuigen,"De kinderen ontdekken de multiculturele wereld door op interactieve wijze gebruik te maken van hun vijf zintuigen: horen, zien, voelen, proeven, ruiken en zeker niet zwijgen. Onder leiding van pedagogisch geschoolde gidsen. Ouders ook welkom",24/07/2011,14:00,16:00,"Café Trefpunt, Bij Sint-Jacobs 18, Gent",0,50,51.0562813,3.7271842
Tomorrow is the Question | Collectie S.M.A.K.,S.M.A.K.stelt een deel van haar omvangrijke collectie tentoon.,24/07/2011,10:00,18:00,"S.M.A.K., Citadelpark 2, Gent",0,50,51.05665,3.72
'Rechtspraak en gerechtigheid.' Themarondleiding in het Stadhuis.,In het stadhuis werd vroeger recht gesproken. Opvallend is het labyrint in de Pacificatiezaal. Die banmijl kon een aantal keren worden afgelegd als straf voor sommige overtreders van de wet.,24/07/2011,16:30,17:15,"Stadhuis, Botermarkt 1, Gent",0,50,51.0545313,3.7253208
Expo Et Cetera,"Et Cetera staat voor textielkunst. Dit vrouwelijke collectief werkt met eeuwenoude technieken, zoals batikken, weven, vilten en shibori.",24/07/2011,10:00,18:00,"MIAT, Minnemeers 9, Gent",0,1000,51.0599955,3.7287123
"Radio 2 animatie in en voor de mobiele studio (locatie : voor stadhuis, in het hart van de Gentse Feesten)","loop eens langs , en ontmoet ons radio-team en hun Gentse Feesten gasten",24/07/2011,15:00,22:00,"Botermarkt, afspraak aan de trappen voor het stadhuis, Botermarkt z/n, Gent",0,50,51.05665,3.72
"Café Cantant, Willy Bart en zijne kluts : optreden","Nen hutsepot van Gentsche liedjes mee Willy Bart, Pat Remue & Sabien",24/07/2011,12:30,14:30,"Bretoens Pannenkoekenhuis Gwenola, Donkersteeg 16, Gent",1,100,51.0546855,3.723231
Waarom is sociale strijd gedegradeerd tot een feestelijk evenementenbureau?,Is sociale verandering en herverdeling mogelijk zonder geweld?,24/07/2011,14:00,18:00,"Minnemeers (NT2Gent), Minnemeers 9, Gent",0,50,51.0599955,3.7287123
Den tijd van den dzoebox,"We nemen u mee naar de jukeboxperiode, naar de flitsende kasten gevuld met vinyl- of cd plaatjes. In een show vol humor, sketches en veel muziek brengen we u de Gentse, Vlaamse en Internationale hits vanaf 1970. Geef Buzze! Duoticket Nico Lennyshow: 20€",24/07/2011,14:30,17:00,"School De Wingerd, Neermeerskaai 1a, Gent",1,1000,51.044251,3.70568
Schuune vrie schuune.     Kano-tocht met Spierke van Gent,"Schelde,Leie,Lieve,Ketelvaart,echt de moeite waard.sPier van Gent is dus present.Zingen is zeker een must,kano-peddelen vol hartenlust.Een trip met je gezin zie je er ook iets in? bij vvk :kinderen (-10j):3 euro(-16j):5 euro !!",24/07/2011,15:45,17:30,"Kromme Wal - Sluizeken, Krommewal , Gent",0,100,51.0592791,3.7262869
Portus Ganda + Oude Dokken per boot met gratis ijsje.  Duur: 1u45,"Met gids van Korenlei, door de sluis, via Portus Ganda en Dampoort naar de Oude Dokken met zijn schitterend stadsvernieuwingsproject en terug. Voor echte kurieuzeneuzen! Tickets afhalen vanaf 1 uur vóór afvaart.",24/07/2011,11:30,13:15,"Aanlegsteiger De Bootjes van Gent-Rederij Dewaele, Korenlei , Gent",0,1000,51.054856,3.7201238
Bezoek belfort,Gent al eens van bovenaf bekeken? Zeker doen tijdens de Gentse Feesten!,24/07/2011,10:00,18:00,"Belfort, Sint-Baafsplein , Gent",0,50,51.0536709,3.7254561
Boerenmarkt - Charles de l' Epéeplein,Boerenmarkt,24/07/2011,08:00,12:30,"Charles de L'Epéeplein , Gent",0,50,51.057712,3.6951777
Buffetformule of BBQ,"Soep, saladebar, 10 verschillende Hoofdschotels, diverse desserten. Reservatie bevestigd bij betaling en afhaling kaarten. Zitplaatsen verzekerd !",24/07/2011,17:30,22:00,"Brasserie Het Volk, Poel 7, Gent",0,50,51.0545335,3.7178529
Mad A & P,Resident-dj’s in Atelier Claus: muzikale veelvraten die weten hoe ze een feestje moeten bouwen.,24/07/2011,23:00,05:00,"Kinky Star, Vlasmarkt 9, Gent",0,50,51.0557895,3.7285385
Maanziek,"Wouter Deprez, Wannes Cappelle en Frans Grapperhaus berichten in  deze voorstelling Maanziek over de kleine dingen des levens. Geen theater, geen comedy, geen muziekoptreden, het is helemaal Wannes, Frans en Wouter.",24/07/2011,20:00,22:00,"THEATERZAAL Kunstencentrum Vooruit, Sint-Pietersnieuwstraat 23, Gent",0,50,51.05665,3.72
Straat 27,Werken van Nina Stoupina in haar eigen galerij.,24/07/2011,14:00,18:00,"Galerij Nina Stoupina, Burgstraat 101, Gent",1,50,51.0563182,3.7160307
Tweedehandsbeurs van boeken over planten.,"Tijdens de nocturnes van 19.30 tot 22.00 en ook op zondagnamiddag 24/7/2011 van 14.30 tot 17.00, is er in het Palmarium een tweedehandsbeurs met boeken over planten, tuinen en landschappen, met medewerking van OXFAM Solidariteit.",24/07/2011,19:30,22:00,"Plantentuin Universiteit Gent, Karel Lodewijk Ledeganckstraat , Gent",1,50,51.036375,3.724129
Hans Teeuwen - Spiksplinter,"Hans Teeuwen is terug! Nadat hij in 2004 voor het laatst als cabaretier op het podium stond met ""Industry of Love"", is Hans terug met zijn fonkelnieuwe cabaretvoorstelling ""Spiksplinter"".",24/07/2011,20:00,21:30,"CAPITOLE GENT, Graaf van Vlaanderenplein 5, Gent",1,5000,51.0480347,3.7319393
Expo Matchbox on tour,"Matchbox is een tentoonstellingsproject op wielen, in de tuin van het MIAT. De Nederlandse Conny Kuilboer en de Russische Nina Stoupina zullen samenwerken. Met feestelijke opening op zondagmiddag 17 juli.",24/07/2011,14:00,17:00,"MIAT, Minnemeers 9, Gent",0,50,51.0599955,3.7287123
La Chèvre Folle,Een a capella-Frans chansonprogramma met verrassingsgasten. Deuren open vanaf: 19.45u,24/07/2011,20:00,21:30,"A Capella, Godshuizenlaan 33, Gent",1,50,51.0432035,3.7165927
Middeleeuws ontbijt en Ontbijt bij Lieven Bauwens,"Een arm en een rijk ontbijt, een ontbijt bij Lieven Bauwens. En nieuw dit jaar: een kinderontbijt! Steeds een goede start voor een dag Gentse Feesten. Geen reservatie mogelijk. Wie voor 11.30 uur aanwezig is, wordt zeker bediend. Prijs €5, €9 of €11.",24/07/2011,08:30,11:30,"MIAT, Minnemeers 9, Gent",0,1000,51.0599955,3.7287123
Rondleidingen in de Etnografische Verzamelingen: Levenswijsheid en geluk! Verrassende voorwerpen uit het traditionele China,Enthousiaste gidsen vertellen bijzondere verhalen over voorwerpen uit het vroegere China. Ga mee op avontuur in de rijke wereld van de Aziatische cultuur en kom in contact met de oosterse wijze van denken en leven en raak vertrouwd met hun esthetiek.,24/07/2011,11:00,12:30,"Het Pand, Onderbergen 1, Gent",0,50,51.052799,3.7198035
CAFE CHANTANT (ne kier wa anders) met Fred Geirnaert en Ronny Marino,Met Fred Geirnaert en Ronny Marino,24/07/2011,11:00,13:00,"Zaal van K. Roeivereniging Sport Gent, Kanodreef 1, Gent",1,100,51.0475162,3.7036577
Kantdemonstraties door de kantclub Sint-Katelijne,"Stropkant, Cluny, florence, Russische kant, moderne kant, bloemwerk, duchesse kant of Vlaamse kant: de leden van de kantclub hebben het allemaal in hun vingers!",24/07/2011,10:00,12:00,"Het Huis van Alijn, Kraanlei 65, Gent",0,1000,51.0574921,3.7234722
Schuune vrie schuune.     Kano-tocht met Spierke van Gent,"Schelde,Leie,Lieve,Ketelvaart,echt de moeite waard.sPier van Gent is dus present.Zingen is zeker een must,kano-peddelen vol hartenlust.Een trip met je gezin zie je er ook iets in? bij vvk :kinderen (-10j):3 euro(-16j):5 euro !!",24/07/2011,17:30,19:15,"Kromme Wal - Sluizeken, Krommewal , Gent",0,100,51.0592791,3.7262869
Kinderopvang & knutselatelier Casa Rosa,"door de vrijwilligers (v/m) van Casa Rosa wordt dagelijkse kinderopvang georganiseerd, met knutsel activiteiten. Voor kleinere kinderen is er een luier ververs tafel voorzien.",24/07/2011,14:00,18:00,"Salon van Casa Rosa vzw, Kammerstraat 22, Gent",0,50,51.0555761,3.7271892
Tienduizend Keer Beter,"Wonderdokters en kwakzalvers, kruiden en gebedjes, pillen en barbiers... Ontdek tijdens deze wandeling hoe je gezond wordt en blijft. 10000 stappen per dag doen je goed, een stappenteller helpt je alvast op weg. Weldadig drankje inbegrepen!",24/07/2011,14:00,16:00,"Infostand Vizit, Corduwaniersstraat 4, Gent",0,50,51.0576395,3.7227266
"Verliefd op Gent, of op het punt het te worden?",Luchtige initiatie-rite tot het statuut van Gentenaar. Sterk aanbevolen voor al wie graag in Gent blijft plakken en zich een muileke Gents wil eigen maken,24/07/2011,19:00,20:00,"Aanlegsteiger De Bootjes Van Gent - Rederij Dewaele, Korenlei , Gent",0,1000,51.054856,3.7201238
Speciale rondleiding ‘Achter de schermen’ in de Etnografische Verzamelingen.,Hoe wordt een voorwerp een museumstuk? Komt elke gift in een vitrine? Werp eens een blik in de reserves. Pas zelf een paar witte handschoenen en betast eens een voorwerp en kom meer te weten over conservatie.   Plaatsen beperkt; reserveren verplicht!,24/07/2011,14:00,15:30,"Het Pand, Onderbergen 1, Gent",0,50,51.052799,3.7198035
Rondvaarten in de Gentse binnenstad,"Rondvaarten in de Gentse binnenstad - 40 minuten. Tijdens de rondvaart ontvangen de eerste 250 klanten een gratis Vedett.  Vertrek & aankomst : Graslei-Gent Watertoerist   Prijs : € 6,50 Volw / € 5,50 Gentenaar / € 3,50 kinderen (-12 jaar)",24/07/2011,11:00,19:00,"Aanlegsteiger Gent Watertoerist, Graslei , Gent",0,50,51.05471,3.72076
Tangram en andere traditionele kinderspelletjes uit China in de Etnografische Verzamelingen,TANGRAM is een Chinees legspel waarbij figuren kunnen worden gevormd uit geometrische stukken. Met zo’n puzzelstuk in de hand speuren en spelen tussen de museumstukken en in de omsloten kloostertuin.   Ouders zijn welkom!,24/07/2011,11:00,12:30,"Het Pand, Onderbergen 1, Gent",0,50,51.052799,3.7198035
Markt in nieuwe koopwaar - Ledebergplein,Markt in nieuwe koopwaar,24/07/2011,07:00,13:00,"Ledebergplein, Ledeberg",0,50,51.0373682,3.7415371
Gent op z'n kookpunt (zoektocht zonder gids),"Wat zat er vroeger in de kookpot? Waarom gebruiken we eigenlijk bestek? Hoe ontstond Gentse waterzooi? Boekje te koop: Kunstglasramen Mestdagh, Drabstraat 2.",24/07/2011,00:00,00:00,"Korenlei /, Gent",0,50,51.054856,3.7201238
Sissie Parker With Dance Team: Trip Around The World (Travestie Revue),"Nieuwe travestie revue, Trip Around The World. Wij nemen U mee rond de wereld met een dance team en 3 travestie's, vol glitter, dans, en showkostuum's. Een 2 uur durend spektakel. Zaal voorzien van airco en gratis parking.",24/07/2011,20:00,23:00,"De Kring S.I.V.I, Maïsstraat 20, Gent",0,100,51.0690921,3.7090273
De muzikant zit in de put,"Enkele intieme akoestische concertjes, tête à tête met de muzikant(en) in de zitput, het salon, het binnenterras of een ander hoekje van café de loge.",24/07/2011,18:00,19:00,"café de loge, Annonciadenstraat 5, Gent",1,50,51.0499472,3.7169582
Elga - Het Panopticum,Elga – Het Panopticum dompelt jou onder in de historiek van Gent waar revolutionaire figuren het voortouw namen. Dit levend museum vind je op de speelplaats van het SKI palend aan het Baudelohof. Een productie in samenwerking met het Vermeylenfonds.,24/07/2011,17:00,17:40,"secundair kunstintituut - speelplaats - ingang via Baudelohof, Ottogracht 4, Gent",0,50,51.0580378,3.7279839
Elga - Het Panopticum,Elga – Het Panopticum dompelt jou onder in de historiek van Gent waar revolutionaire figuren het voortouw namen. Dit levend museum vind je op de speelplaats van het SKI palend aan het Baudelohof. Een productie in samenwerking met het Vermeylenfonds.,24/07/2011,20:00,20:40,"secundair kunstintituut - speelplaats - ingang via Baudelohof, Ottogracht 4, Gent",0,50,51.0580378,3.7279839
Elga - Het Panopticum,Elga – Het Panopticum dompelt jou onder in de historiek van Gent waar revolutionaire figuren het voortouw namen. Dit levend museum vind je op de speelplaats van het SKI palend aan het Baudelohof. Een productie in samenwerking met het Vermeylenfonds.,24/07/2011,21:00,21:40,"secundair kunstintituut - speelplaats - ingang via Baudelohof, Ottogracht 4, Gent",0,50,51.0580378,3.7279839
'Rechtspraak en gerechtigheid.' Themarondleiding in het Stadhuis.,In het stadhuis werd vroeger recht gesproken. Opvallend is het labyrint in de Pacificatiezaal. Die banmijl kon een aantal keren worden afgelegd als straf voor sommige overtreders van de wet.,24/07/2011,17:30,18:15,"Stadhuis, Botermarkt 1, Gent",0,50,51.0545313,3.7253208
"Boottocht ""Gent Compleet"" + gratis ijsje. Duur: 90 min.","Gegidste boottocht op Leie, Lieve, Ketelvaart & Schelde. Ook doorvaart onder 't Laurentplein. 1000 jaar architectuur en verhalen op het parcours. Tickets afhalen van vanaf 1 uur vóór afvaart, ten laatste 15 minuten vóór afvaart.",24/07/2011,14:00,15:30,"Aanlegsteiger Boat in Gent, bij Gravensteen (50m), Kraanlei , Gent",0,1000,51.0569531,3.7226146
De blauwe appelaar,"Professor Nostradamus heeft een geweldige uitvinding gedaan. De goedgelovige, naïeve Wiebel verklapt dit aan duivelsmeester Hoetepetoet. Hoetepetoet smeedt snode plannen om de uitvinding te vernietigen. Pierke moet dit verhinderen.",24/07/2011,15:00,16:30,"Het Huis van Alijn, Kraanlei 65, Gent",0,1000,51.0574921,3.7234722
